{"generated_at":"2026-10-11T16:01:39+0000","season":2026,"n_teams":16,"records":[{"team":"Afturelding","round_name":"R16","probability":1},{"team":"Afturelding","round_name":"QF","probability":1},{"team":"Afturelding","round_name":"SF","probability":1},{"team":"Afturelding","round_name":"Final","probability":1},{"team":"Afturelding","round_name":"Champion","probability":0},{"team":"Breiðablik","round_name":"R16","probability":1},{"team":"Breiðablik","round_name":"QF","probability":1},{"team":"Breiðablik","round_name":"SF","probability":1},{"team":"Breiðablik","round_name":"Final","probability":1},{"team":"Breiðablik","round_name":"Champion","probability":1},{"team":"FH","round_name":"R16","probability":1},{"team":"FH","round_name":"QF","probability":0},{"team":"FH","round_name":"SF","probability":0},{"team":"FH","round_name":"Final","probability":0},{"team":"FH","round_name":"Champion","probability":0},{"team":"Fylkir","round_name":"R16","probability":1},{"team":"Fylkir","round_name":"QF","probability":1},{"team":"Fylkir","round_name":"SF","probability":1},{"team":"Fylkir","round_name":"Final","probability":0},{"team":"Fylkir","round_name":"Champion","probability":0},{"team":"Grindavík","round_name":"R16","probability":1},{"team":"Grindavík","round_name":"QF","probability":0},{"team":"Grindavík","round_name":"SF","probability":0},{"team":"Grindavík","round_name":"Final","probability":0},{"team":"Grindavík","round_name":"Champion","probability":0},{"team":"Grótta","round_name":"R16","probability":1},{"team":"Grótta","round_name":"QF","probability":1},{"team":"Grótta","round_name":"SF","probability":0},{"team":"Grótta","round_name":"Final","probability":0},{"team":"Grótta","round_name":"Champion","probability":0},{"team":"HK","round_name":"R16","probability":1},{"team":"HK","round_name":"QF","probability":0},{"team":"HK","round_name":"SF","probability":0},{"team":"HK","round_name":"Final","probability":0},{"team":"HK","round_name":"Champion","probability":0},{"team":"KA","round_name":"R16","probability":1},{"team":"KA","round_name":"QF","probability":0},{"team":"KA","round_name":"SF","probability":0},{"team":"KA","round_name":"Final","probability":0},{"team":"KA","round_name":"Champion","probability":0},{"team":"KR","round_name":"R16","probability":1},{"team":"KR","round_name":"QF","probability":0},{"team":"KR","round_name":"SF","probability":0},{"team":"KR","round_name":"Final","probability":0},{"team":"KR","round_name":"Champion","probability":0},{"team":"Njarðvík","round_name":"R16","probability":1},{"team":"Njarðvík","round_name":"QF","probability":0},{"team":"Njarðvík","round_name":"SF","probability":0},{"team":"Njarðvík","round_name":"Final","probability":0},{"team":"Njarðvík","round_name":"Champion","probability":0},{"team":"Stjarnan","round_name":"R16","probability":1},{"team":"Stjarnan","round_name":"QF","probability":1},{"team":"Stjarnan","round_name":"SF","probability":0},{"team":"Stjarnan","round_name":"Final","probability":0},{"team":"Stjarnan","round_name":"Champion","probability":0},{"team":"Vestri","round_name":"R16","probability":1},{"team":"Vestri","round_name":"QF","probability":0},{"team":"Vestri","round_name":"SF","probability":0},{"team":"Vestri","round_name":"Final","probability":0},{"team":"Vestri","round_name":"Champion","probability":0},{"team":"Víkingur R.","round_name":"R16","probability":1},{"team":"Víkingur R.","round_name":"QF","probability":1},{"team":"Víkingur R.","round_name":"SF","probability":1},{"team":"Víkingur R.","round_name":"Final","probability":0},{"team":"Víkingur R.","round_name":"Champion","probability":0},{"team":"Ægir","round_name":"R16","probability":1},{"team":"Ægir","round_name":"QF","probability":1},{"team":"Ægir","round_name":"SF","probability":0},{"team":"Ægir","round_name":"Final","probability":0},{"team":"Ægir","round_name":"Champion","probability":0},{"team":"ÍA","round_name":"R16","probability":1},{"team":"ÍA","round_name":"QF","probability":1},{"team":"ÍA","round_name":"SF","probability":0},{"team":"ÍA","round_name":"Final","probability":0},{"team":"ÍA","round_name":"Champion","probability":0},{"team":"Þróttur R.","round_name":"R16","probability":1},{"team":"Þróttur R.","round_name":"QF","probability":0},{"team":"Þróttur R.","round_name":"SF","probability":0},{"team":"Þróttur R.","round_name":"Final","probability":0},{"team":"Þróttur R.","round_name":"Champion","probability":0}],"summary":[{"team":"Breiðablik","p_champion":1},{"team":"Afturelding","p_champion":0},{"team":"FH","p_champion":0},{"team":"Fylkir","p_champion":0},{"team":"Grindavík","p_champion":0},{"team":"Grótta","p_champion":0},{"team":"HK","p_champion":0},{"team":"KA","p_champion":0},{"team":"KR","p_champion":0},{"team":"Njarðvík","p_champion":0},{"team":"Stjarnan","p_champion":0},{"team":"Vestri","p_champion":0},{"team":"Víkingur R.","p_champion":0},{"team":"Ægir","p_champion":0},{"team":"ÍA","p_champion":0},{"team":"Þróttur R.","p_champion":0}]}
