{"generated_at":"2026-10-21T23:26:54+0000","season":2026,"n_teams":16,"records":[{"team":"Breiðablik","round_name":"R16","probability":1},{"team":"Breiðablik","round_name":"QF","probability":0},{"team":"Breiðablik","round_name":"SF","probability":0},{"team":"Breiðablik","round_name":"Final","probability":0},{"team":"Breiðablik","round_name":"Champion","probability":0},{"team":"FH","round_name":"R16","probability":1},{"team":"FH","round_name":"QF","probability":1},{"team":"FH","round_name":"SF","probability":0},{"team":"FH","round_name":"Final","probability":0},{"team":"FH","round_name":"Champion","probability":0},{"team":"FHL","round_name":"R16","probability":1},{"team":"FHL","round_name":"QF","probability":1},{"team":"FHL","round_name":"SF","probability":0},{"team":"FHL","round_name":"Final","probability":0},{"team":"FHL","round_name":"Champion","probability":0},{"team":"Fram","round_name":"R16","probability":1},{"team":"Fram","round_name":"QF","probability":1},{"team":"Fram","round_name":"SF","probability":1},{"team":"Fram","round_name":"Final","probability":0},{"team":"Fram","round_name":"Champion","probability":0},{"team":"Fylkir","round_name":"R16","probability":1},{"team":"Fylkir","round_name":"QF","probability":0},{"team":"Fylkir","round_name":"SF","probability":0},{"team":"Fylkir","round_name":"Final","probability":0},{"team":"Fylkir","round_name":"Champion","probability":0},{"team":"Grindavík/Njarðvík","round_name":"R16","probability":1},{"team":"Grindavík/Njarðvík","round_name":"QF","probability":1},{"team":"Grindavík/Njarðvík","round_name":"SF","probability":1},{"team":"Grindavík/Njarðvík","round_name":"Final","probability":1},{"team":"Grindavík/Njarðvík","round_name":"Champion","probability":0},{"team":"Keflavík","round_name":"R16","probability":1},{"team":"Keflavík","round_name":"QF","probability":0},{"team":"Keflavík","round_name":"SF","probability":0},{"team":"Keflavík","round_name":"Final","probability":0},{"team":"Keflavík","round_name":"Champion","probability":0},{"team":"Selfoss","round_name":"R16","probability":1},{"team":"Selfoss","round_name":"QF","probability":0},{"team":"Selfoss","round_name":"SF","probability":0},{"team":"Selfoss","round_name":"Final","probability":0},{"team":"Selfoss","round_name":"Champion","probability":0},{"team":"Stjarnan","round_name":"R16","probability":1},{"team":"Stjarnan","round_name":"QF","probability":1},{"team":"Stjarnan","round_name":"SF","probability":0},{"team":"Stjarnan","round_name":"Final","probability":0},{"team":"Stjarnan","round_name":"Champion","probability":0},{"team":"Tindastóll","round_name":"R16","probability":1},{"team":"Tindastóll","round_name":"QF","probability":0},{"team":"Tindastóll","round_name":"SF","probability":0},{"team":"Tindastóll","round_name":"Final","probability":0},{"team":"Tindastóll","round_name":"Champion","probability":0},{"team":"Valur","round_name":"R16","probability":1},{"team":"Valur","round_name":"QF","probability":0},{"team":"Valur","round_name":"SF","probability":0},{"team":"Valur","round_name":"Final","probability":0},{"team":"Valur","round_name":"Champion","probability":0},{"team":"Víkingur R.","round_name":"R16","probability":1},{"team":"Víkingur R.","round_name":"QF","probability":1},{"team":"Víkingur R.","round_name":"SF","probability":0},{"team":"Víkingur R.","round_name":"Final","probability":0},{"team":"Víkingur R.","round_name":"Champion","probability":0},{"team":"ÍA","round_name":"R16","probability":1},{"team":"ÍA","round_name":"QF","probability":0},{"team":"ÍA","round_name":"SF","probability":0},{"team":"ÍA","round_name":"Final","probability":0},{"team":"ÍA","round_name":"Champion","probability":0},{"team":"ÍBV","round_name":"R16","probability":1},{"team":"ÍBV","round_name":"QF","probability":1},{"team":"ÍBV","round_name":"SF","probability":1},{"team":"ÍBV","round_name":"Final","probability":0},{"team":"ÍBV","round_name":"Champion","probability":0},{"team":"Þróttur R.","round_name":"R16","probability":1},{"team":"Þróttur R.","round_name":"QF","probability":1},{"team":"Þróttur R.","round_name":"SF","probability":1},{"team":"Þróttur R.","round_name":"Final","probability":1},{"team":"Þróttur R.","round_name":"Champion","probability":1},{"team":"Þór/KA","round_name":"R16","probability":1},{"team":"Þór/KA","round_name":"QF","probability":0},{"team":"Þór/KA","round_name":"SF","probability":0},{"team":"Þór/KA","round_name":"Final","probability":0},{"team":"Þór/KA","round_name":"Champion","probability":0}],"summary":[{"team":"Þróttur R.","p_champion":1},{"team":"Breiðablik","p_champion":0},{"team":"FH","p_champion":0},{"team":"FHL","p_champion":0},{"team":"Fram","p_champion":0},{"team":"Fylkir","p_champion":0},{"team":"Grindavík/Njarðvík","p_champion":0},{"team":"Keflavík","p_champion":0},{"team":"Selfoss","p_champion":0},{"team":"Stjarnan","p_champion":0},{"team":"Tindastóll","p_champion":0},{"team":"Valur","p_champion":0},{"team":"Víkingur R.","p_champion":0},{"team":"ÍA","p_champion":0},{"team":"ÍBV","p_champion":0},{"team":"Þór/KA","p_champion":0}]}
